{
  "username": "Rinzler78",
  "public_repos": 51,
  "total_stars": 34,
  "last_push": "2026-09-26",
  "fetched_at": "2026-09-26",
  "external": {
    "osmobot-csharp": {
      "stars": 1,
      "fetched_at": "2026-09-26"
    },
    "personnalfinanceassistant": {
      "stars": 0,
      "fetched_at": "2026-09-26"
    },
    "ffbb-api-client-v2": {
      "pypi_downloads_last_month": 320,
      "pypi_releases": 8,
      "stars": 11,
      "fetched_at": "2026-09-26"
    },
    "cometbft-client": {
      "stars": 0,
      "fetched_at": "2026-09-26"
    },
    "python-playground": {
      "stars": 0,
      "fetched_at": "2026-09-26"
    },
    "osmosis-launcher": {
      "stars": 1,
      "fetched_at": "2026-09-26"
    },
    "docker-idena-node": {
      "docker_pulls": 1671,
      "stars": 6,
      "fetched_at": "2026-09-26"
    },
    "efextension": {
      "stars": 1,
      "fetched_at": "2026-09-26"
    },
    "scripts": {
      "stars": 0,
      "fetched_at": "2026-09-26"
    },
    "ffbb-api-client-v1": {
      "pypi_downloads_last_month": 27,
      "pypi_releases": 26,
      "stars": 3,
      "fetched_at": "2026-09-26"
    },
    "catmash": {
      "stars": 0,
      "fetched_at": "2026-09-26"
    },
    "osmobot-docker": {
      "stars": 2,
      "fetched_at": "2026-09-26"
    },
    "pythonrefactortoolbox": {
      "stars": 0,
      "fetched_at": "2026-09-26"
    },
    "xamtetris": {
      "stars": 0,
      "fetched_at": "2026-09-26"
    },
    "condo": {
      "stars": 0,
      "fetched_at": "2026-09-26"
    },
    "aspnetcoreextension": {
      "stars": 1,
      "fetched_at": "2026-09-26"
    },
    "magicapiclientcreator": {
      "stars": 0,
      "fetched_at": "2026-09-26"
    },
    "osmosisfullnode": {
      "docker_pulls": 234,
      "stars": 1,
      "fetched_at": "2026-09-26"
    },
    "deployment": {
      "stars": 0,
      "fetched_at": "2026-09-26"
    },
    "rayonnancexftest": {
      "stars": 0,
      "fetched_at": "2026-09-26"
    },
    "duedilportal": {
      "docker_pulls": 243,
      "stars": 1,
      "fetched_at": "2026-09-26"
    },
    "aioz-node-auto-withdraw": {
      "docker_pulls": 400,
      "stars": 1,
      "fetched_at": "2026-09-26"
    },
    "aioz-node-docker": {
      "docker_pulls": 355,
      "stars": 2,
      "fetched_at": "2026-09-26"
    },
    "xamyard": {
      "stars": 0,
      "fetched_at": "2026-09-26"
    },
    "apiclientgenerator": {
      "stars": 0,
      "fetched_at": "2026-09-26"
    },
    "skillvalue": {
      "stars": 0,
      "fetched_at": "2026-09-26"
    },
    "net-extension": {
      "stars": 1,
      "fetched_at": "2026-09-26"
    },
    "docker-cleaner": {
      "docker_pulls": 473,
      "stars": 0,
      "fetched_at": "2026-09-26"
    }
  },
  "errors": []
}
